{"acquisition_after":"01ee320e8b7fe072157599e67a6656b40162da9416c57dbeb26efaf30fe93559","acquisition_attempts":1,"acquisition_before":"01ee320e8b7fe072157599e67a6656b40162da9416c57dbeb26efaf30fe93559","base":"a48e7d7880cb37ea6898d462ae188a6213a5f3f8","canonicalization":"rs-canonical-json-v1","canonicalization_ms":38,"computation_ms":7746,"content_hashing_ms":78,"created_utc":"2026-10-16T21:26:49.1869128Z","files":[{"base_mode":"100644","base_sha256":"35724521f38eb3974965407c03018979ad9089460e8b7b814f091b847acff6ad","index_mode":"100644","index_sha256":"35724521f38eb3974965407c03018979ad9089460e8b7b814f091b847acff6ad","old_path":null,"path":".gitattributes","status":"modified","worktree_sha256":"97d87aaef1d57631c0d65e94d93978886b811f17b8fb59b26f44061db182cd4a","worktree_size_bytes":38120},{"base_mode":"100644","base_sha256":"ba9475da828b2e2c924551bf2f68d06e9d5c50a783d0ac7502602718abb1781d","index_mode":"100644","index_sha256":"ba9475da828b2e2c924551bf2f68d06e9d5c50a783d0ac7502602718abb1781d","old_path":null,"path":"RedSalamander/FolderWindow.FileOperations.State.cpp","status":"modified","worktree_sha256":"562f183e2301c4d6a451fd1fc4ea6caac748198fd3796b48d83c272180069913","worktree_size_bytes":1325794},{"base_mode":"100644","base_sha256":"19e35ec34393d6e309ee842c4f9d0acc876e7b8b287da0f42cee24f75d84f018","index_mode":"100644","index_sha256":"19e35ec34393d6e309ee842c4f9d0acc876e7b8b287da0f42cee24f75d84f018","old_path":null,"path":"RedSalamander/FolderWindow.FileOperations.cpp","status":"modified","worktree_sha256":"92b7583be1c7dc17bdadda35ce4ac288b467cb68b6b7da61c1e7f594fdd5852f","worktree_size_bytes":271267},{"base_mode":"100644","base_sha256":"66dddd2abe678fed693f027bccade7601b5c9d4eacb0c151a152341086cf966d","index_mode":"100644","index_sha256":"66dddd2abe678fed693f027bccade7601b5c9d4eacb0c151a152341086cf966d","old_path":null,"path":"RedSalamander/FolderWindow.FileOperationsInternal.h","status":"modified","worktree_sha256":"b1c33bb46faeef70f68c0e892510500fe6ae871db9378e959fa75543232d32a4","worktree_size_bytes":189689},{"base_mode":"100644","base_sha256":"db47f8c5226da0987d8d0167e40f9c445b4ea60712fe1803fd2c82ab7f486b0d","index_mode":"100644","index_sha256":"db47f8c5226da0987d8d0167e40f9c445b4ea60712fe1803fd2c82ab7f486b0d","old_path":null,"path":"RedSalamander/Lang/cs-CZ/RedSalamander-cs-CZ.rc","status":"modified","worktree_sha256":"1f13e11e9b7ccfe4de1c0928bf41ef37eaecdb0e0135b5683ae8a912b05adaf4","worktree_size_bytes":228077},{"base_mode":"100644","base_sha256":"46099ac4c059d5583ca2152e8351a8dde3182f9091c3edc264d25017876b4efb","index_mode":"100644","index_sha256":"46099ac4c059d5583ca2152e8351a8dde3182f9091c3edc264d25017876b4efb","old_path":null,"path":"RedSalamander/Lang/fr-FR/RedSalamander-fr-FR.rc","status":"modified","worktree_sha256":"0affcf2e36083fb78e58c46066c161b9d3f7fd1fd332bd330147b7f4c7c204f6","worktree_size_bytes":235803},{"base_mode":"100644","base_sha256":"484905ae118c027aac142c214d6f047114c910fa2677930a02c1a34923e07d3b","index_mode":"100644","index_sha256":"484905ae118c027aac142c214d6f047114c910fa2677930a02c1a34923e07d3b","old_path":null,"path":"RedSalamander/Lang/ja-JP/RedSalamander-ja-JP.rc","status":"modified","worktree_sha256":"25809f4214920ef780278d2b2937b371a64df44694c136832803f8a73da3433c","worktree_size_bytes":253579},{"base_mode":"100644","base_sha256":"14cab3e405729184bf7c589177cffa7e8142ea31bbfcbc8bac93213f71b77725","index_mode":"100644","index_sha256":"14cab3e405729184bf7c589177cffa7e8142ea31bbfcbc8bac93213f71b77725","old_path":null,"path":"RedSalamander/Lang/sk-SK/RedSalamander-sk-SK.rc","status":"modified","worktree_sha256":"3cdbb7f0a3ad505d4664a79e37fa55893d898069252b16748a31f561a63f33da","worktree_size_bytes":229479},{"base_mode":"100644","base_sha256":"3635d3f4bdc2c00c20002076feeb03832fcf9952801a09bbb789b60d0e86c61e","index_mode":"100644","index_sha256":"3635d3f4bdc2c00c20002076feeb03832fcf9952801a09bbb789b60d0e86c61e","old_path":null,"path":"RedSalamander/RedSalamander.rc","status":"modified","worktree_sha256":"418d349e79b547055869b5ba09779826471aa0fb4ea41a2d389ddc09ce841299","worktree_size_bytes":220996},{"base_mode":"100644","base_sha256":"ee9c0e71d66f4e3355e7e2dfaa3c75f034d5b9f019ebadd050258093f5121b6d","index_mode":"100644","index_sha256":"ee9c0e71d66f4e3355e7e2dfaa3c75f034d5b9f019ebadd050258093f5121b6d","old_path":null,"path":"RedSalamander/Resource.h","status":"modified","worktree_sha256":"c58338ebeb6ff7eca01614e6393267177a7f64755018d48a3cf9e321b5223cd4","worktree_size_bytes":125568},{"base_mode":"100644","base_sha256":"c51b491f75c34e47639c01febf0269288022511a29b679595c2a2ea0dabb69cd","index_mode":"100644","index_sha256":"c51b491f75c34e47639c01febf0269288022511a29b679595c2a2ea0dabb69cd","old_path":null,"path":"RedSalamander/SelfTest/FileOperations/FolderWindow.FileOperations.Tests.ItemResultReducer.cpp","status":"modified","worktree_sha256":"5b507bee0db9de5189d2987c80411bcc0a896ec3fde21f0a5d499436ab0fdda8","worktree_size_bytes":147465},{"base_mode":"100644","base_sha256":"561716012631cc964dce84288edf86d227418e3f56ed62662b475c6939422f99","index_mode":"100644","index_sha256":"561716012631cc964dce84288edf86d227418e3f56ed62662b475c6939422f99","old_path":null,"path":"RedSalamander/SelfTest/FileOperations/FolderWindow.FileOperations.Tests.Runner.cpp","status":"modified","worktree_sha256":"9e5f4fb140331e4966c82f3a5abeb2aa860747f64413933028dbbe05788c344e","worktree_size_bytes":921798},{"base_mode":"100644","base_sha256":"3d6b026e60fa33da1b79a12fc23410ca3fff3adf1053cd95ae2be5dff861cb8f","index_mode":"100644","index_sha256":"3d6b026e60fa33da1b79a12fc23410ca3fff3adf1053cd95ae2be5dff861cb8f","old_path":null,"path":"Specs/FileSystem/FileSystem_FileOperations.md","status":"modified","worktree_sha256":"fde32cd064f1ad8998ddb4d669b4fe1ad74682de2bceca13cd9bc06d9054a2eb","worktree_size_bytes":280626},{"base_mode":"100644","base_sha256":"c3a8ec0f99c2d97516da81d70620f889b031aecb02345677f2fb1bbadaa14ff2","index_mode":"100644","index_sha256":"c3a8ec0f99c2d97516da81d70620f889b031aecb02345677f2fb1bbadaa14ff2","old_path":null,"path":"Specs/UI/UI_FileOperationsPopup.md","status":"modified","worktree_sha256":"deb12fa4ca8df2c0c22124dd7d46f06e5a87f748c3e4da0616dcedf05352e372","worktree_size_bytes":246662}],"git_discovery_ms":3695,"git_head":"a48e7d7880cb37ea6898d462ae188a6213a5f3f8","repo_identity":"14485fa9cd38441813b8d2caf691a125eb09be34cddf546aa7172d7564f71f77","schema":"red-salamander.workspace-snapshot.v1","snapshot_id":"01ee320e8b7fe072157599e67a6656b40162da9416c57dbeb26efaf30fe93559"}
