{"acquisition_after":"002c2fd168c6fca57d78150b0eef8f131962d1a3f116948b9d071af8f009c005","acquisition_attempts":1,"acquisition_before":"002c2fd168c6fca57d78150b0eef8f131962d1a3f116948b9d071af8f009c005","base":"d8d7127d0ba57a6cad6bf2add8118f6bf219a11c","canonicalization":"rs-canonical-json-v1","canonicalization_ms":5,"computation_ms":3845,"content_hashing_ms":33,"created_utc":"2026-09-20T08:47:03.7939351Z","files":[{"base_mode":"100644","base_sha256":"10e7a4b4659e537e66af19276e729c0956004f34e9545a7544883cdf80aa42e4","index_mode":"100644","index_sha256":"10e7a4b4659e537e66af19276e729c0956004f34e9545a7544883cdf80aa42e4","old_path":null,"path":"RedSalamander/SelfTest/Commands/Commands.SelfTest.FileOps.cpp","status":"modified","worktree_sha256":"0993f49aafe62ba7f1a6a74985bd1eeb50f9b8dd1b0aa3bf33f08034f53f3a58","worktree_size_bytes":642742}],"git_discovery_ms":1796,"git_head":"d8d7127d0ba57a6cad6bf2add8118f6bf219a11c","repo_identity":"14485fa9cd38441813b8d2caf691a125eb09be34cddf546aa7172d7564f71f77","schema":"red-salamander.workspace-snapshot.v1","snapshot_id":"002c2fd168c6fca57d78150b0eef8f131962d1a3f116948b9d071af8f009c005"}
