{"acquisition_after":"3be7cc158093a805b7a0226e5a4bff7f9d33f792684b066ebe2b2125dea6984b","acquisition_attempts":1,"acquisition_before":"3be7cc158093a805b7a0226e5a4bff7f9d33f792684b066ebe2b2125dea6984b","base":"1277ffdec9cf78b5452d29f695aae7806fffe207","canonicalization":"rs-canonical-json-v1","canonicalization_ms":4,"computation_ms":4495,"content_hashing_ms":154,"created_utc":"2026-10-10T00:06:07.2529337Z","files":[{"base_mode":"100644","base_sha256":"da048d6f6321855394bcafda60e0dcaaf459cd6f34d726e8dd3403299f2cb9bc","index_mode":"100644","index_sha256":"da048d6f6321855394bcafda60e0dcaaf459cd6f34d726e8dd3403299f2cb9bc","old_path":null,"path":"Dependencies/DxUi.lock.json","status":"modified","worktree_sha256":"c49a0ef6d729f81c53142af6e7cf6e3403ae881ea3f0ca040b7c895971e61bae","worktree_size_bytes":175},{"base_mode":"100644","base_sha256":"ca0ad025363e5b37c25185e94938bb5954cf7ef0c338968c0459e1bcce821b33","index_mode":"100644","index_sha256":"ca0ad025363e5b37c25185e94938bb5954cf7ef0c338968c0459e1bcce821b33","old_path":null,"path":"Plugins/ViewerSpace/ViewerSpace.cpp","status":"modified","worktree_sha256":"d19d9206324ea55c3bded669173497e704b32df1600fb4cd80119b8393213ea3","worktree_size_bytes":408475},{"base_mode":"100644","base_sha256":"f1af9d1e44980df8eea24b7bf91d75acc864163801367dba686427cc555d0878","index_mode":"100644","index_sha256":"f1af9d1e44980df8eea24b7bf91d75acc864163801367dba686427cc555d0878","old_path":null,"path":"Plugins/ViewerSpace/ViewerSpace.h","status":"modified","worktree_sha256":"c0112a9a94eda0b4e2e0dddbd87e02b68bdd74b6e8130e2dffe6abbb7117f7d4","worktree_size_bytes":24785},{"base_mode":"100644","base_sha256":"1a33ca2eed0a31e5fbefb5aebd17ba5b18625e0956f0f3e73022a5d019e6e205","index_mode":"100644","index_sha256":"1a33ca2eed0a31e5fbefb5aebd17ba5b18625e0956f0f3e73022a5d019e6e205","old_path":null,"path":"RedSalamander/SelfTest/Commands/Commands.Tests.Runner.cpp","status":"modified","worktree_sha256":"1af67ba7ea719ec65e23b18516bcb3d44b73a943882c7e051f5305a1f4233468","worktree_size_bytes":30169},{"base_mode":"100644","base_sha256":"94d7537a47bddf3d016ac32b6fa0b28df844b1cc11ef5c4887746507050ce87a","index_mode":"100644","index_sha256":"94d7537a47bddf3d016ac32b6fa0b28df844b1cc11ef5c4887746507050ce87a","old_path":null,"path":"RedSalamander/SelfTest/Commands/Commands.Tests.ViewCommands.cpp","status":"modified","worktree_sha256":"8fec082bab4b36d819ee66f47d9bdb0196f6cd7122df51f0b879f6ec92f302cc","worktree_size_bytes":1635689}],"git_discovery_ms":1586,"git_head":"1277ffdec9cf78b5452d29f695aae7806fffe207","repo_identity":"ce173d6d4e8ad8715b2fd1d0823a4ef07b694de5c5ee6515762f27585001060c","schema":"red-salamander.workspace-snapshot.v1","snapshot_id":"3be7cc158093a805b7a0226e5a4bff7f9d33f792684b066ebe2b2125dea6984b"}
