{"acquisition_after":"aeae66efb25b50ba6b8bdaf4a1119b54fee400a5477bb4398f05b7f43c4cf443","acquisition_attempts":1,"acquisition_before":"aeae66efb25b50ba6b8bdaf4a1119b54fee400a5477bb4398f05b7f43c4cf443","base":"9a4d243416fa503899c2f44e4242a1276db1cef9","canonicalization":"rs-canonical-json-v1","canonicalization_ms":50,"computation_ms":9823,"content_hashing_ms":91,"created_utc":"2026-10-18T18:47:40.8342464Z","files":[{"base_mode":"100644","base_sha256":"1a0a0ca03a44caee3ad06d5437320bbc3ea4ad5efed0f855104d375b3d5202d4","index_mode":"100644","index_sha256":"1a0a0ca03a44caee3ad06d5437320bbc3ea4ad5efed0f855104d375b3d5202d4","old_path":null,"path":".gitattributes","status":"modified","worktree_sha256":"e3214cf99a29e4ba8d3f8737295bc17fbfb75e6a427fd93054bdf91cd5368590","worktree_size_bytes":40222},{"base_mode":"100644","base_sha256":"1acdd54c8dae22688e98588996f619d92a31b36d65dae10aee0095a544e73158","index_mode":"100644","index_sha256":"1acdd54c8dae22688e98588996f619d92a31b36d65dae10aee0095a544e73158","old_path":null,"path":".github/dependabot.yml","status":"modified","worktree_sha256":"d9e5232b16f9436088aacd5e2331d571952093f2d06b6c07f9fa285135bddf72","worktree_size_bytes":1804},{"base_mode":"100644","base_sha256":"cc43e0fdd4f239e6623ab9cd95837c4c0ed4ef864cf29400822a62eac94a5e64","index_mode":"100644","index_sha256":"cc43e0fdd4f239e6623ab9cd95837c4c0ed4ef864cf29400822a62eac94a5e64","old_path":null,"path":".github/workflows/terminal-engine-gate0.yml","status":"modified","worktree_sha256":"e6f15b6fef9c0d367e12dc7f43cb769106dc982934658f501120728599f32d1c","worktree_size_bytes":9144},{"base_mode":"100644","base_sha256":"755717e5f8b12680dd3d8e5c1da97568209b3336bca2a715ca33a16b26ad1a41","index_mode":"100644","index_sha256":"755717e5f8b12680dd3d8e5c1da97568209b3336bca2a715ca33a16b26ad1a41","old_path":null,"path":"RedSalamander/SelfTest/FileOperations/FolderWindow.FileOperations.Tests.Phases05_06.cpp","status":"modified","worktree_sha256":"3d97ffab199a7058dbc9d91dc151449a5aae17a1b621e6949ac702850edb5758","worktree_size_bytes":936359},{"base_mode":"100644","base_sha256":"91d2581f737181827a66a38ee78d2a3a5281c56099b6f916214da3606ef3ef2d","index_mode":"100644","index_sha256":"91d2581f737181827a66a38ee78d2a3a5281c56099b6f916214da3606ef3ef2d","old_path":null,"path":"RedSalamander/SelfTest/FileOperations/FolderWindow.FileOperations.Tests.Phases10_13.cpp","status":"modified","worktree_sha256":"3c22299d02589d32060fceeda941b91d033d8accb10b96c40bfd8b319fcbebbd","worktree_size_bytes":556275},{"base_mode":"100644","base_sha256":"fb44abf09e9bf6a69bd01ab2ce03e3efb2e8b390d2557f2ceb509b645bdb27e8","index_mode":"100644","index_sha256":"fb44abf09e9bf6a69bd01ab2ce03e3efb2e8b390d2557f2ceb509b645bdb27e8","old_path":null,"path":"Specs/Testing/Testing_PerformanceValidation.md","status":"modified","worktree_sha256":"b874ee202d7433d3b9d5f4f828988bf5a5ed76b71faa86ff8bfdfb2f02e773c4","worktree_size_bytes":189611},{"base_mode":"100644","base_sha256":"22affec31f8d292c2862c450e9c6602867b93665aa1ed91cf977b4851cffa565","index_mode":"100644","index_sha256":"22affec31f8d292c2862c450e9c6602867b93665aa1ed91cf977b4851cffa565","old_path":null,"path":"Specs/Testing/Testing_ToolingGovernance.md","status":"modified","worktree_sha256":"3b72b9ac57887844ccddd2f7f114d7339226ba5410c7ced6425fe741ef6b6a66","worktree_size_bytes":23756},{"base_mode":"100644","base_sha256":"544feca32584aa61da31c998da426e0889c19372f31f9b00b1e368efc48b6312","index_mode":"100644","index_sha256":"544feca32584aa61da31c998da426e0889c19372f31f9b00b1e368efc48b6312","old_path":null,"path":"Specs/Testing/Testing_ValidationEvidence.md","status":"modified","worktree_sha256":"47784f3c88fbb0e6843b71abd5af83dab973207ede1e841468224e876f01faaa","worktree_size_bytes":34149},{"base_mode":"100644","base_sha256":"3bb3335a8708aea62869d3ab87c2644c744f7da0f9855fb2cb707d7b3e2ab506","index_mode":"100644","index_sha256":"3bb3335a8708aea62869d3ab87c2644c744f7da0f9855fb2cb707d7b3e2ab506","old_path":null,"path":"Specs/UI/UI_FileOperationsPopup.md","status":"modified","worktree_sha256":"0576a151a853692a26447e1bb25518caf8a0a9c374faf7fd404a569f0a7307ae","worktree_size_bytes":247871},{"base_mode":"100644","base_sha256":"5a6bf60dbb53f44e5f8acec7426e383b27a351d5f15b0326aadda2221bc9a48c","index_mode":"100644","index_sha256":"5a6bf60dbb53f44e5f8acec7426e383b27a351d5f15b0326aadda2221bc9a48c","old_path":null,"path":"Tests/test-scopes.json","status":"modified","worktree_sha256":"e080d3e21cedf93104bf0b10de8ae31c579f45c7262f86df21274dfc4be4715b","worktree_size_bytes":932},{"base_mode":"100644","base_sha256":"6b8fbd40f00fca2eee0a1624d0d4aec0842d57fe7b9e14e0d4b57f451965fa38","index_mode":"100644","index_sha256":"6b8fbd40f00fca2eee0a1624d0d4aec0842d57fe7b9e14e0d4b57f451965fa38","old_path":null,"path":"Tools/README.md","status":"modified","worktree_sha256":"9ca42a8f3a03961540fd7405cff26bdfd5ff0523ab9ca48e738b27f97164e647","worktree_size_bytes":30085},{"base_mode":"100644","base_sha256":"92d241443f59d058a5626493f372f9789a7b9e6c0caefa12821cea19fce88a4a","index_mode":"100644","index_sha256":"92d241443f59d058a5626493f372f9789a7b9e6c0caefa12821cea19fce88a4a","old_path":null,"path":"Tools/Tests/HistoricalTerminalProfile.Tests.ps1","status":"modified","worktree_sha256":"d7a209c684c8e9788af7a89545b9c9420f78eba0a249d016a31a8c7dd486a045","worktree_size_bytes":7270},{"base_mode":"100644","base_sha256":"186ca6b046548649b5d03b7db78b0ef59ef8d880ff70eee6a52f642bbe66ce8c","index_mode":"100644","index_sha256":"186ca6b046548649b5d03b7db78b0ef59ef8d880ff70eee6a52f642bbe66ce8c","old_path":null,"path":"Tools/Tests/ReleaseWorkflowPolicy.Tests.ps1","status":"modified","worktree_sha256":"420c02aa9ab23975cce95f736dbe9df9d67a6138036b1a139bb7f677adace6a1","worktree_size_bytes":75183},{"base_mode":"100644","base_sha256":"67bdd17c030320f4f3815a574dc5b4fded29adcfa8659ab251987c8892ba385d","index_mode":"100644","index_sha256":"67bdd17c030320f4f3815a574dc5b4fded29adcfa8659ab251987c8892ba385d","old_path":null,"path":"Tools/tool-inventory.json","status":"modified","worktree_sha256":"3adf21b734c7241f8dab204d533752768f996a0f7143a31a1a0e96ff004de6b0","worktree_size_bytes":150788}],"git_discovery_ms":4287,"git_head":"9a4d243416fa503899c2f44e4242a1276db1cef9","repo_identity":"14485fa9cd38441813b8d2caf691a125eb09be34cddf546aa7172d7564f71f77","schema":"red-salamander.workspace-snapshot.v1","snapshot_id":"aeae66efb25b50ba6b8bdaf4a1119b54fee400a5477bb4398f05b7f43c4cf443"}
