{"acquisition_after":"1ecd3b1f2acb6a79f863bdffd02c6520a7fcc24a080c46e72010cef6d6db6685","acquisition_attempts":1,"acquisition_before":"1ecd3b1f2acb6a79f863bdffd02c6520a7fcc24a080c46e72010cef6d6db6685","base":"46c10f61b9b0cad80b4a31dcf92b0fd3c456df61","canonicalization":"rs-canonical-json-v1","canonicalization_ms":19,"computation_ms":4181,"content_hashing_ms":44,"created_utc":"2026-09-21T00:27:04.1714242Z","files":[{"base_mode":"100644","base_sha256":"9c1f80073332228ed3ada15d77639dc4463d7eaf865b3605db0e5b84af71722b","index_mode":"100644","index_sha256":"9c1f80073332228ed3ada15d77639dc4463d7eaf865b3605db0e5b84af71722b","old_path":null,"path":"RedSalamander/FolderWindow.FileOperations.Popup.cpp","status":"modified","worktree_sha256":"b966f087526622c159174e19f1577ed9b6a98bb948d201b399d8f8230ce1a93d","worktree_size_bytes":662938},{"base_mode":"100644","base_sha256":"58db4e37b81023d8eabf6f43b1b5c5059067afb48ae6950151fda71d57051be5","index_mode":"100644","index_sha256":"58db4e37b81023d8eabf6f43b1b5c5059067afb48ae6950151fda71d57051be5","old_path":null,"path":"RedSalamander/FolderWindow.FileOperations.Popup.h","status":"modified","worktree_sha256":"3c512ca245b005f07749c2db9255342fc8fa0409e3c3dbd48e1012806736d7ed","worktree_size_bytes":54865},{"base_mode":"100644","base_sha256":"ee9e6a7532bafd17d420f2320a61b902b22d360e9d381aee5c66eea42d4b9d7e","index_mode":"100644","index_sha256":"ee9e6a7532bafd17d420f2320a61b902b22d360e9d381aee5c66eea42d4b9d7e","old_path":null,"path":"RedSalamander/SelfTest/Commands/Commands.SelfTest.FileOps.cpp","status":"modified","worktree_sha256":"0e5fdda1c0f37e755f6330cbf9cae6dce1de264ca7af1a4d592eebf57b641231","worktree_size_bytes":750720},{"base_mode":"100644","base_sha256":"761bf6c97da45f02391d71b2e5e87aa815e698f8f1e9a2011691a48f890f2a94","index_mode":"100644","index_sha256":"761bf6c97da45f02391d71b2e5e87aa815e698f8f1e9a2011691a48f890f2a94","old_path":null,"path":"RedSalamander/SelfTest/Commands/Commands.SelfTest.cpp","status":"modified","worktree_sha256":"344036db3ef7eb3adb4ee9696977b5295157e42e03b0bc87c89f3288c9550be7","worktree_size_bytes":26844},{"base_mode":"100644","base_sha256":"25cb561dea6ca50f3b5bc995df34a2071c8a5600310c2f0d77f91f875b2acc65","index_mode":"100644","index_sha256":"25cb561dea6ca50f3b5bc995df34a2071c8a5600310c2f0d77f91f875b2acc65","old_path":null,"path":"Specs/Plans/WIP/UI_FileOperationsReview_2026-09-16.md","status":"modified","worktree_sha256":"06e563003eea5767f427ccdcac98e1652c528edf474b5e1beb36cd59ade9149b","worktree_size_bytes":148871},{"base_mode":"100644","base_sha256":"9089e3503cf740b10be22894dab7c9127615ef20f72dcec7334199af41588540","index_mode":"100644","index_sha256":"9089e3503cf740b10be22894dab7c9127615ef20f72dcec7334199af41588540","old_path":null,"path":"Specs/Testing/Testing_PerformanceValidation.md","status":"modified","worktree_sha256":"6b385b7f59ce7d0084e28a8d39d4fae300303bb66738adb5f44c21d4b7b48e07","worktree_size_bytes":147827}],"git_discovery_ms":1911,"git_head":"46c10f61b9b0cad80b4a31dcf92b0fd3c456df61","repo_identity":"14485fa9cd38441813b8d2caf691a125eb09be34cddf546aa7172d7564f71f77","schema":"red-salamander.workspace-snapshot.v1","snapshot_id":"1ecd3b1f2acb6a79f863bdffd02c6520a7fcc24a080c46e72010cef6d6db6685"}
