{"acquisition_after":"6a6c606bfbb05f705d7accc2d32f707fa03a13422d03cb736c10bbf5b9b085e5","acquisition_attempts":1,"acquisition_before":"6a6c606bfbb05f705d7accc2d32f707fa03a13422d03cb736c10bbf5b9b085e5","base":"a6670299df7b9f542432032cde82700f995cdfda","canonicalization":"rs-canonical-json-v1","canonicalization_ms":40,"computation_ms":9020,"content_hashing_ms":71,"created_utc":"2026-10-19T11:14:08.7362019Z","files":[{"base_mode":"100644","base_sha256":"023deeff82ec215b21a393c7837bcd27f93baae00e307a5e4ec229973cd513de","index_mode":"100644","index_sha256":"88faa6829d724b9a7c36298fa1423eba8c517c39dacd466d57c3a4c15a25e0e9","old_path":null,"path":".gitattributes","status":"modified","worktree_sha256":"dbe9553513c94b11b7123284468d570745c4cacf97fe02be5a1258341f1f6dfe","worktree_size_bytes":41486},{"base_mode":"100644","base_sha256":"7a4ab9e53a08df060278fb8c0b725a17532cb536a60e236e2e8a661f831b310e","index_mode":"100644","index_sha256":"35d05cb025cd8fe967eb38b5a8f77324f9187159230f711d2c947e49bc8e56e8","old_path":null,"path":"AGENTS.md","status":"modified","worktree_sha256":"938a8343ed62fd07ed865fe8f65d93b858bb02c9fdf9cd1bf2861050a26da2da","worktree_size_bytes":24012},{"base_mode":"100644","base_sha256":"47c92a3b166fc59d7f975d9a5fcbacf8e525bf2689cdc0b3e3bdc54ad304e2af","index_mode":"100644","index_sha256":"3c1c404e071970e2f63708ef0421c342b4b4a06917f83765c14309222460e9df","old_path":null,"path":"RedSalamander/SelfTest/FileOperations/FolderWindow.FileOperations.Tests.Runner.cpp","status":"modified","worktree_sha256":"53e473a90af4552a3614bc4f9e75aefdd161b551ca759ae019e872ba5b64fbdb","worktree_size_bytes":964368},{"base_mode":"100644","base_sha256":"b4fc10efbf058d6458ac80a05a3f1c9886f8befc2f46554efac428041642cf79","index_mode":"100644","index_sha256":"f03a629de38d83da075bc6740832f504195a3908d63929ab326499d0fb6ce68b","old_path":null,"path":"RedSalamander/SelfTest/FileOperations/FolderWindow.FileOperations.Tests.VisualGallery.cpp","status":"modified","worktree_sha256":"4559dc1760cf9dd799ee26cea969577b9123446a5abc4b9c7992982e25061250","worktree_size_bytes":283343},{"base_mode":null,"base_sha256":null,"index_mode":"100644","index_sha256":"7733b747b810d1f1a82af8b9840ff8e0345005fba2601b0dd7a8cecd6eba5328","old_path":null,"path":"Specs/Plans/Done/FileOperations_DocumentationPrivacy_2026-10-19.md","status":"added","worktree_sha256":"91c7405667715362cfa3f8d79da2608f10fa5334c64cd70ac759235ad43eeb93","worktree_size_bytes":2309},{"base_mode":null,"base_sha256":null,"index_mode":"100644","index_sha256":"1f3d47c89d443533bc7f8b9295bd0b6bf83780c38ab122c04faa7c479f26ce54","old_path":null,"path":"Specs/Plans/WIP/ScreenshotSyntheticData_2026-10-19.md","status":"added","worktree_sha256":"1f3d47c89d443533bc7f8b9295bd0b6bf83780c38ab122c04faa7c479f26ce54","worktree_size_bytes":1088},{"base_mode":"100644","base_sha256":"74061548c95fbc197dbfef7e7a25653745af63b0e677a7f6b24b2080879c16c7","index_mode":"100644","index_sha256":"12ad72af00c6075456e9b2f4f88d8f382313925c28a42cc61b62122ea071d650","old_path":null,"path":"Specs/Testing/Testing_SelfTests.md","status":"modified","worktree_sha256":"019671229e7d4dc04ba130762e5910ce1e05d2b702764683ff339b8c48e4000b","worktree_size_bytes":220384},{"base_mode":"100644","base_sha256":"975b5868c0203281aaec9afc2c154a0b9924d73a59e4fb010ca684e74beafc08","index_mode":"100644","index_sha256":"e1ca9dec65e7b814dd276efc861ceaffac5750cba62006d42cfa54d0fe8beb04","old_path":null,"path":"docs/FileOperations.md","status":"modified","worktree_sha256":"547f0389ba51b3f130fc4600dcf10b9d849cb125eed77d59f050db942ae69c8f","worktree_size_bytes":36226},{"base_mode":"100644","base_sha256":"36105320cdea1545468df1298622a6560016a28881f56de6ba2e84c4e487360a","index_mode":"100644","index_sha256":"a58c73ce322c5c645b432c07ab003750735e5a9426fd6426f6dc7a7b9cb36530","old_path":null,"path":"docs/res/file-operations-issues.png","status":"modified","worktree_sha256":"a58c73ce322c5c645b432c07ab003750735e5a9426fd6426f6dc7a7b9cb36530","worktree_size_bytes":62702},{"base_mode":null,"base_sha256":null,"index_mode":"100644","index_sha256":"a37e3ea8d9a41a4f6fae485b2c16b8c6a22532a79e515224cd491a048392ae08","old_path":null,"path":"docs/res/file-operations-issues.provenance.json","status":"added","worktree_sha256":"ba4a45d13319737494dd119f2ce26a5ad28f07ee10149b6209cd04766e3ad8d4","worktree_size_bytes":1633},{"base_mode":"100644","base_sha256":"98bd979e7e0c8ffd33c26fc8d06f319ee346fc69df40a9efec2de4cc7d515695","index_mode":"100644","index_sha256":"097794f2f44ac7b81b31420824388f24a6fe18d0079a47e6b87b3e25b11fdc5b","old_path":null,"path":"docs/res/file-operations-popup.png","status":"modified","worktree_sha256":"097794f2f44ac7b81b31420824388f24a6fe18d0079a47e6b87b3e25b11fdc5b","worktree_size_bytes":63028},{"base_mode":"100644","base_sha256":"2f06f386e9db28e75658abdb2b1b20acfc3a458e0b7fecdfd206e11d81d7a3bc","index_mode":"100644","index_sha256":"97af8fab6772b7ba83f27ea70feccfce8cdd571069cdc08132dcf67d28996fa7","old_path":null,"path":"docs/res/file-operations-popup.provenance.json","status":"modified","worktree_sha256":"33a58430d9aab025e0177d28cfd4307259ed8d2d7f6444f590edbebae013f25b","worktree_size_bytes":1615}],"git_discovery_ms":4460,"git_head":"a6670299df7b9f542432032cde82700f995cdfda","repo_identity":"14485fa9cd38441813b8d2caf691a125eb09be34cddf546aa7172d7564f71f77","schema":"red-salamander.workspace-snapshot.v1","snapshot_id":"6a6c606bfbb05f705d7accc2d32f707fa03a13422d03cb736c10bbf5b9b085e5"}
