{"acquisition_after":"73ec3957a8c79b5adddc958accb41bda81fd416e590bdda563417929465b1095","acquisition_attempts":1,"acquisition_before":"73ec3957a8c79b5adddc958accb41bda81fd416e590bdda563417929465b1095","base":"217bff62bab70fb064f7574bd10af83dc932615c","canonicalization":"rs-canonical-json-v1","canonicalization_ms":3,"computation_ms":1958,"content_hashing_ms":0,"created_utc":"2026-08-31T10:35:35.7927575Z","files":[],"git_discovery_ms":941,"git_head":"217bff62bab70fb064f7574bd10af83dc932615c","repo_identity":"130267d3ad785dc22d868aa8d9b0047ef865ab686a0cb55144eae718b851028e","schema":"red-salamander.workspace-snapshot.v1","snapshot_id":"73ec3957a8c79b5adddc958accb41bda81fd416e590bdda563417929465b1095"}


