{"acquisition_after":"f60cbfa0f33feb421c3b22459e1b607c4e8895b79cdde3316eff9ad0a100e7f8","acquisition_attempts":1,"acquisition_before":"f60cbfa0f33feb421c3b22459e1b607c4e8895b79cdde3316eff9ad0a100e7f8","base":"caad89d85262e1499601169143d20fd1b11263cd","canonicalization":"rs-canonical-json-v1","canonicalization_ms":3,"computation_ms":3478,"content_hashing_ms":0,"created_utc":"2026-09-14T19:26:26.7169788Z","files":[],"git_discovery_ms":1675,"git_head":"caad89d85262e1499601169143d20fd1b11263cd","repo_identity":"14485fa9cd38441813b8d2caf691a125eb09be34cddf546aa7172d7564f71f77","schema":"red-salamander.workspace-snapshot.v1","snapshot_id":"f60cbfa0f33feb421c3b22459e1b607c4e8895b79cdde3316eff9ad0a100e7f8"}
