{"acquisition_after":"2ab4d5375164fe267256c4833192eb6ba40f6dce601150179e3e7efa2b42a5e0","acquisition_attempts":1,"acquisition_before":"2ab4d5375164fe267256c4833192eb6ba40f6dce601150179e3e7efa2b42a5e0","base":"3dcf7ab167211451882f2c50e202aec68a5a4318","canonicalization":"rs-canonical-json-v1","canonicalization_ms":36,"computation_ms":2567,"content_hashing_ms":96,"created_utc":"2026-09-08T16:05:32.0824055Z","files":[{"base_mode":"100644","base_sha256":"a315a2e73abcc9222fd0964cb7e0284e012799c6f887fbd505c0e8d5684b161c","index_mode":"100644","index_sha256":"a315a2e73abcc9222fd0964cb7e0284e012799c6f887fbd505c0e8d5684b161c","old_path":null,"path":"Plugins/Terminal/TerminalSession.cpp","status":"modified","worktree_sha256":"3c339074d10adf4f7a83df06d5ea66c9224da018b31804d63f1eaa5de3387e41","worktree_size_bytes":44127},{"base_mode":"100644","base_sha256":"1e3103f3ae8999bab13faa507d2e805f753622e791028233a54556741122d189","index_mode":"100644","index_sha256":"1e3103f3ae8999bab13faa507d2e805f753622e791028233a54556741122d189","old_path":null,"path":"Plugins/Terminal/TerminalVt.cpp","status":"modified","worktree_sha256":"5ba393b10217a028323acf6ac5f41e30cc8f52457fdb09e443aee446b7512c89","worktree_size_bytes":91002},{"base_mode":"100644","base_sha256":"373976cbbce3828f44f507683251328708090a510939789512f9fc1eb4c6db29","index_mode":"100644","index_sha256":"373976cbbce3828f44f507683251328708090a510939789512f9fc1eb4c6db29","old_path":null,"path":"RedSalamander/FolderWindow.Interaction.cpp","status":"modified","worktree_sha256":"3665529ee01525dac38293c822592f0c7b36cecddbba243e5ba0dc77f9955f42","worktree_size_bytes":42654},{"base_mode":"100644","base_sha256":"4263232802137d14b9e9e670102931beaffff204ac7313c511496414f52c08c4","index_mode":"100644","index_sha256":"4263232802137d14b9e9e670102931beaffff204ac7313c511496414f52c08c4","old_path":null,"path":"RedSalamander/SelfTest/Commands/Commands.SelfTest.Navigation.cpp","status":"modified","worktree_sha256":"8cda9caadbdba2d43cc6363de9dd87a1970ee069efdaf88eb0b760fb2f3d48b4","worktree_size_bytes":642771},{"base_mode":"100644","base_sha256":"c718a086f9270f69fcf91bd6d36757b8b3a20da4753e79e593b25d2958cd9764","index_mode":"100644","index_sha256":"c718a086f9270f69fcf91bd6d36757b8b3a20da4753e79e593b25d2958cd9764","old_path":null,"path":"Specs/FileSystem/FileSystem_FileOperations.md","status":"modified","worktree_sha256":"ec29813e6ea0a5d13e972b23bde22f916a45b7770146d2fd3dbd2e3b6b9b983c","worktree_size_bytes":151614},{"base_mode":"100644","base_sha256":"5ac36525bdae5f0decb92a92cbefbbc8bfa5cfb85d6ffe4d4968c24a8fdeec24","index_mode":"100644","index_sha256":"5ac36525bdae5f0decb92a92cbefbbc8bfa5cfb85d6ffe4d4968c24a8fdeec24","old_path":null,"path":"Specs/NormativeConsistency.json","status":"modified","worktree_sha256":"5057b1ff114410918e39947b7ed3ac4411284cf63b4b6629554a948a92d9ca65","worktree_size_bytes":64591},{"base_mode":"100644","base_sha256":"e71d47a751aeac5d3736b57f60c4b1282197b8d6149c939004ba15eb5d6c01a6","index_mode":"100644","index_sha256":"e71d47a751aeac5d3736b57f60c4b1282197b8d6149c939004ba15eb5d6c01a6","old_path":null,"path":"Specs/Plans/WIP/Operation_FileOperations_LaterFeatures_2026-09-05.md","status":"modified","worktree_sha256":"f0590c126205660d4e6105dc8596aa9dff1a94b3a09dd2c3f18d58dc510b436d","worktree_size_bytes":20104},{"base_mode":"100644","base_sha256":"8aef66c2bd73cc8484448c21bf6e03c50f4b77050546265547f0129e659aef4e","index_mode":"100644","index_sha256":"8aef66c2bd73cc8484448c21bf6e03c50f4b77050546265547f0129e659aef4e","old_path":null,"path":"Specs/Plans/WIP/Operation_ReviewFollowup_FOTerminalFocus_2026-08-19.md","status":"modified","worktree_sha256":"57ae844e01862568c59bfa2d53a77aac63640013b944441d114910981d9bd1e0","worktree_size_bytes":12073},{"base_mode":"100644","base_sha256":"a781b5825851089afcf07aee7e0c8da8aa9012a0e523b661278c8f9d96eeba00","index_mode":"100644","index_sha256":"a781b5825851089afcf07aee7e0c8da8aa9012a0e523b661278c8f9d96eeba00","old_path":null,"path":"Specs/Plans/WIP/README.md","status":"modified","worktree_sha256":"231b7ed6c2256f7e2827ad76e5e75e965518775190144e840f1c8c944cd68da8","worktree_size_bytes":23835},{"base_mode":null,"base_sha256":null,"index_mode":null,"index_sha256":null,"old_path":null,"path":"Specs/Plans/WIP/UI_ConfirmationPreferencesAndOperationOutcomes_2026-09-08.md","status":"untracked","worktree_sha256":"831261ecd253916aed8cf37b472a0b967aa5a1524d7c369304c8d13d90d27ce2","worktree_size_bytes":69732},{"base_mode":"100644","base_sha256":"fddd5e377b183eb98ec29dcd2aa88f2bf40622c04114174c0f0dd4c60f0f05d2","index_mode":"100644","index_sha256":"fddd5e377b183eb98ec29dcd2aa88f2bf40622c04114174c0f0dd4c60f0f05d2","old_path":null,"path":"Specs/Terminal/Terminal_EmbeddedPlugin.md","status":"modified","worktree_sha256":"23df067d4400178caa9413c218992138fd154aaef16e8c50490b88de346ac6ae","worktree_size_bytes":106609},{"base_mode":"100644","base_sha256":"fede20829be75dae53492d747507d52a210396e0ecc9677717ce4e94d9df9b03","index_mode":"100644","index_sha256":"fede20829be75dae53492d747507d52a210396e0ecc9677717ce4e94d9df9b03","old_path":null,"path":"Specs/UI/UI_CommandMenuKeyboard.md","status":"modified","worktree_sha256":"bfb96dd3994b230b0c9034ee8cf9d56ab4fda6af9b9e279e5ade72091128b79e","worktree_size_bytes":132482},{"base_mode":"100644","base_sha256":"b4ec09b4d4b4d62b6727a0b822cdeaa6f749f65a0dbc49885561a15007302366","index_mode":"100644","index_sha256":"b4ec09b4d4b4d62b6727a0b822cdeaa6f749f65a0dbc49885561a15007302366","old_path":null,"path":"Tools/Modules/Tooling/SpecInformationArchitecture.psm1","status":"modified","worktree_sha256":"3b3958b3a917e10cb9d2b2c3af511cda527843c970b7bba1c0db8ca32ea1b434","worktree_size_bytes":37446},{"base_mode":"100644","base_sha256":"6b6ba1ce149eb8802630ddeb56e5353394e4cc192d981fe270b889905991fe9d","index_mode":"100644","index_sha256":"6b6ba1ce149eb8802630ddeb56e5353394e4cc192d981fe270b889905991fe9d","old_path":null,"path":"Tools/Tests/SpecInformationArchitecture.Tests.ps1","status":"modified","worktree_sha256":"990309185b083f0226dffcc3a46e71c587773337d5778d2ec1fa11dd49579cf1","worktree_size_bytes":23081},{"base_mode":"100644","base_sha256":"bad0a7a27d9fd5ba84635aa53cf438e546a13c84ef2c5b4b08e0bd9c2e273505","index_mode":"100644","index_sha256":"bad0a7a27d9fd5ba84635aa53cf438e546a13c84ef2c5b4b08e0bd9c2e273505","old_path":null,"path":"Tools/Tests/TerminalPluginSourceContracts.Tests.ps1","status":"modified","worktree_sha256":"018e9878acefc79e9064ecf863e963a4aa028bdaac5c792e9d2b331ee7ee156d","worktree_size_bytes":62248}],"git_discovery_ms":1176,"git_head":"3dcf7ab167211451882f2c50e202aec68a5a4318","repo_identity":"14485fa9cd38441813b8d2caf691a125eb09be34cddf546aa7172d7564f71f77","schema":"red-salamander.workspace-snapshot.v1","snapshot_id":"2ab4d5375164fe267256c4833192eb6ba40f6dce601150179e3e7efa2b42a5e0"}
