{
  "schema": "red-salamander.workspace-snapshot.v1",
  "canonicalization": "rs-canonical-json-v1",
  "snapshot_id": "295a8527742890ef7111979c26f25b87b1686b9f9d1e100591abf1ee06b46f35",
  "repo_identity": "14485fa9cd38441813b8d2caf691a125eb09be34cddf546aa7172d7564f71f77",
  "git_head": "a4b506d53b92d716a923199ba436463f95a6e375",
  "base": "a4b506d53b92d716a923199ba436463f95a6e375",
  "files": [
    {
      "path": ".gitattributes",
      "status": "modified",
      "base_sha256": "231107d69403bae9acad3131214bbe7314f7e13cf810dd7988b88e67e9e6d9ca",
      "base_mode": "100644",
      "index_sha256": "231107d69403bae9acad3131214bbe7314f7e13cf810dd7988b88e67e9e6d9ca",
      "index_mode": "100644",
      "worktree_sha256": "0c82f3b14478a7043fb685f3fd49edeaa8d2e0dfaa5c28330c862201b001c90b",
      "worktree_size_bytes": 40523,
      "old_path": null
    },
    {
      "path": "Plugins/FileSystem/FileSystem.FileOps.cpp",
      "status": "modified",
      "base_sha256": "fd77fc4eba5271ff01af88833effb889971ad6e6a13e54604750e030f9809933",
      "base_mode": "100644",
      "index_sha256": "fd77fc4eba5271ff01af88833effb889971ad6e6a13e54604750e030f9809933",
      "index_mode": "100644",
      "worktree_sha256": "ecf9500594b9cfee40f0f49276c5f3079ea06c6ae2b7e182e8fecd2f6c7542bc",
      "worktree_size_bytes": 649452,
      "old_path": null
    },
    {
      "path": "Plugins/FileSystem/FileSystem.cpp",
      "status": "modified",
      "base_sha256": "f01c05e2bc8132e5d5c0b95c8bec291eb37146ef5a641e5c1540e32727455bc6",
      "base_mode": "100644",
      "index_sha256": "f01c05e2bc8132e5d5c0b95c8bec291eb37146ef5a641e5c1540e32727455bc6",
      "index_mode": "100644",
      "worktree_sha256": "3a9cf4e53952dadee42163218433dff254269fc0550ae80810e85ae3f4ce16fd",
      "worktree_size_bytes": 352860,
      "old_path": null
    },
    {
      "path": "RedSalamander/FolderWindow.FileOperations.State.cpp",
      "status": "modified",
      "base_sha256": "2472ebdf8e33487f8865310b0dd83177a92dc210640da170fe5e66134442ecf0",
      "base_mode": "100644",
      "index_sha256": "2472ebdf8e33487f8865310b0dd83177a92dc210640da170fe5e66134442ecf0",
      "index_mode": "100644",
      "worktree_sha256": "47884c1e76cb33f20293803e7a2a08dd53fb693763b9f49076513e0cf7995a4a",
      "worktree_size_bytes": 1340934,
      "old_path": null
    },
    {
      "path": "RedSalamander/FolderWindow.FileOperationsInternal.h",
      "status": "modified",
      "base_sha256": "859206e87a487e81df95f63572dc424d1e49ab42778d201234e66252b827525b",
      "base_mode": "100644",
      "index_sha256": "859206e87a487e81df95f63572dc424d1e49ab42778d201234e66252b827525b",
      "index_mode": "100644",
      "worktree_sha256": "bcd797b5df8910c329d595d732dc5f654b2451224def0ae81a87295aa8511092",
      "worktree_size_bytes": 190389,
      "old_path": null
    },
    {
      "path": "RedSalamander/SelfTest/FileOperations/FolderWindow.FileOperations.Tests.DiscoveryClosure.cpp",
      "status": "modified",
      "base_sha256": "d40dd6357a5cc7965e21710bf998c1ac0845714d2c7dac8c5c5df7e34e05d357",
      "base_mode": "100644",
      "index_sha256": "d40dd6357a5cc7965e21710bf998c1ac0845714d2c7dac8c5c5df7e34e05d357",
      "index_mode": "100644",
      "worktree_sha256": "9db1c01bc7c95d688e262fc79800e164b6205a6e7af31c7321898e4067b36edd",
      "worktree_size_bytes": 182674,
      "old_path": null
    },
    {
      "path": "RedSalamander/SelfTest/FileOperations/FolderWindow.FileOperations.Tests.Throughput.cpp",
      "status": "modified",
      "base_sha256": "cbc20c82f06b3c462b633484dce2c0b9b3d62228f6a6dcb3a5f5036c1fca5e68",
      "base_mode": "100644",
      "index_sha256": "cbc20c82f06b3c462b633484dce2c0b9b3d62228f6a6dcb3a5f5036c1fca5e68",
      "index_mode": "100644",
      "worktree_sha256": "01ff022c963c00bf9ee0e857f7a38ecb37243f95a7e26b80a0c56841b039b5c5",
      "worktree_size_bytes": 113813,
      "old_path": null
    },
    {
      "path": "Specs/FileSystem/FileSystem_FileOperations.md",
      "status": "modified",
      "base_sha256": "924fdaaa475aa92f0430537e50c58db9acd7b9612f75946d1f68af41d4a818c1",
      "base_mode": "100644",
      "index_sha256": "924fdaaa475aa92f0430537e50c58db9acd7b9612f75946d1f68af41d4a818c1",
      "index_mode": "100644",
      "worktree_sha256": "d52811024262d3dd046dd9cc50a0e93909f39bff79083beafae31a38557bf141",
      "worktree_size_bytes": 286902,
      "old_path": null
    },
    {
      "path": "Specs/Testing/Testing_PerformanceValidation.md",
      "status": "modified",
      "base_sha256": "5428e80e95e6b3e3c97c13dd24acc76a77c12a694a25ee20f05f86db7c2d5a28",
      "base_mode": "100644",
      "index_sha256": "5428e80e95e6b3e3c97c13dd24acc76a77c12a694a25ee20f05f86db7c2d5a28",
      "index_mode": "100644",
      "worktree_sha256": "cd86cf2e0cef33a981ca363bb3b2562acea4152da06fd949196f079cc552fb6d",
      "worktree_size_bytes": 194267,
      "old_path": null
    }
  ],
  "acquisition_before": "295a8527742890ef7111979c26f25b87b1686b9f9d1e100591abf1ee06b46f35",
  "acquisition_after": "295a8527742890ef7111979c26f25b87b1686b9f9d1e100591abf1ee06b46f35",
  "acquisition_attempts": 1,
  "git_discovery_ms": 3466,
  "content_hashing_ms": 96,
  "canonicalization_ms": 29,
  "computation_ms": 8055,
  "created_utc": "2026-10-18T22:07:58.5278153Z"
}
