{"acquisition_after":"6f6a6b0faf385d16ed815b38aef5c392338d4eabb812d8f3475de4276b9517cc","acquisition_attempts":1,"acquisition_before":"6f6a6b0faf385d16ed815b38aef5c392338d4eabb812d8f3475de4276b9517cc","base":"ccebd5af68eb45f2e9deed64a7063780e71eb1ce","canonicalization":"rs-canonical-json-v1","canonicalization_ms":44,"computation_ms":5301,"content_hashing_ms":65,"created_utc":"2026-09-23T10:45:25.9699082Z","files":[{"base_mode":null,"base_sha256":null,"index_mode":null,"index_sha256":null,"old_path":null,"path":"RedSalamander/FileOperationsFooterLayout.h","status":"untracked","worktree_sha256":"a1b3f9b36b5d2a35afd1d663cd576305db7d454bff4b06c03ddd7a3120f71711","worktree_size_bytes":3848},{"base_mode":"100644","base_sha256":"1b93b86bf76763931178e1ffa3e72d4a3170fb2c6c95f8efd4941d3247175251","index_mode":"100644","index_sha256":"1b93b86bf76763931178e1ffa3e72d4a3170fb2c6c95f8efd4941d3247175251","old_path":null,"path":"RedSalamander/FolderWindow.FileOperations.Popup.cpp","status":"modified","worktree_sha256":"69a2ac126b3272c30d86cad03d3d4b296d6f4c9475f124eb64c3ebdf6ea79ea1","worktree_size_bytes":676766},{"base_mode":"100644","base_sha256":"f4333825f53af0be7b362a13db75d11512671ce74e39baa9e13d6583c639ae29","index_mode":"100644","index_sha256":"f4333825f53af0be7b362a13db75d11512671ce74e39baa9e13d6583c639ae29","old_path":null,"path":"RedSalamander/FolderWindow.FileOperations.Popup.h","status":"modified","worktree_sha256":"e25496dbdcd07a3f2d8d4af7812e6eafcf218c02f964ccc8d9481c890f957ad2","worktree_size_bytes":57233},{"base_mode":"100644","base_sha256":"1364a7eeea1d5c8584277e465cd4362f403cfc39ad9f7c991264487f70b5501d","index_mode":"100644","index_sha256":"1364a7eeea1d5c8584277e465cd4362f403cfc39ad9f7c991264487f70b5501d","old_path":null,"path":"RedSalamander/RedSalamander.vcxproj","status":"modified","worktree_sha256":"1808ddf7f43864f67c7c62e9ebc1bb6a6903b617716a8f3aa40ae8f98c51ea64","worktree_size_bytes":36249},{"base_mode":"100644","base_sha256":"5d7ad016f1405708cb253b710627abd2a3efe74daad3b62b008a264a29c33c82","index_mode":"100644","index_sha256":"5d7ad016f1405708cb253b710627abd2a3efe74daad3b62b008a264a29c33c82","old_path":null,"path":"RedSalamander/SelfTest/FileOperations/FolderWindow.FileOperations.SelfTest.VisualGallery.cpp","status":"modified","worktree_sha256":"22db9bd83a475cdf859eedb8bfe6082078ebb26e05a9a7fdb64d2b20fb1a81cd","worktree_size_bytes":60316},{"base_mode":"100644","base_sha256":"74a22ef35511bda25adf00e19e9b57280121423f64ebf4782ab117a64182596f","index_mode":"100644","index_sha256":"74a22ef35511bda25adf00e19e9b57280121423f64ebf4782ab117a64182596f","old_path":null,"path":"RedSalamander/SelfTest/FileOperations/FolderWindow.FileOperations.SelfTest.VisualGallerySurfaces.cpp","status":"modified","worktree_sha256":"9acabe54d0523626871db42e09fc11e5a2f4bc55cd69a9cb99c3f773116bd960","worktree_size_bytes":15383},{"base_mode":"100644","base_sha256":"337043643aa80e2759ca633339a5cf0af1c60e9418f4c8ba0ba736b0721b0ca7","index_mode":"100644","index_sha256":"337043643aa80e2759ca633339a5cf0af1c60e9418f4c8ba0ba736b0721b0ca7","old_path":null,"path":"RedSalamander/Ui/AlertOverlayWindow.cpp","status":"modified","worktree_sha256":"bcf4d7f1a5f4cc966286eff418a45139f9c9b57815270afdd4e0a1b43243aebc","worktree_size_bytes":65094},{"base_mode":"100644","base_sha256":"cd32aa511a3fc079a157160934661098f3a8775858f97cc6b71b4a21696812d9","index_mode":"100644","index_sha256":"cd32aa511a3fc079a157160934661098f3a8775858f97cc6b71b4a21696812d9","old_path":null,"path":"RedSalamander/Ui/AlertOverlayWindow.h","status":"modified","worktree_sha256":"821623ccdbea312d72e494b785cf4744650890d01acf0d5996cd20f4f29270c2","worktree_size_bytes":7131},{"base_mode":"100644","base_sha256":"60ecf1ded5c0f3d3bfa7dbb8549f0fc9d3f4b420b8ac9822be785ce54ac60d26","index_mode":"100644","index_sha256":"60ecf1ded5c0f3d3bfa7dbb8549f0fc9d3f4b420b8ac9822be785ce54ac60d26","old_path":null,"path":"Tests/ProductUiTests/ProductUiTests.cpp","status":"modified","worktree_sha256":"9b47a88cab42378da734f9db723b72b699b6fedd4641c4d7c7504489e3e77b81","worktree_size_bytes":91285}],"git_discovery_ms":2401,"git_head":"ccebd5af68eb45f2e9deed64a7063780e71eb1ce","repo_identity":"fcada11a3a40743ab8434e4103123d8fb8263d20171103936518f47fc742d7f5","schema":"red-salamander.workspace-snapshot.v1","snapshot_id":"6f6a6b0faf385d16ed815b38aef5c392338d4eabb812d8f3475de4276b9517cc"}
