{"acquisition_after":"a8f9a67de89f37a41bda47df69a4c81ce6edbec5572dc18dad9118ee7bbe4c2d","acquisition_attempts":1,"acquisition_before":"a8f9a67de89f37a41bda47df69a4c81ce6edbec5572dc18dad9118ee7bbe4c2d","base":"ccebd5af68eb45f2e9deed64a7063780e71eb1ce","canonicalization":"rs-canonical-json-v1","canonicalization_ms":38,"computation_ms":5003,"content_hashing_ms":62,"created_utc":"2026-09-23T09:48:18.3165169Z","files":[{"base_mode":null,"base_sha256":null,"index_mode":null,"index_sha256":null,"old_path":null,"path":"RedSalamander/FileOperationsFooterLayout.h","status":"untracked","worktree_sha256":"0cbe222e4782155c759a3d5513fc7d25d96f5b4df6de13b22720c17563f31650","worktree_size_bytes":3096},{"base_mode":"100644","base_sha256":"1b93b86bf76763931178e1ffa3e72d4a3170fb2c6c95f8efd4941d3247175251","index_mode":"100644","index_sha256":"1b93b86bf76763931178e1ffa3e72d4a3170fb2c6c95f8efd4941d3247175251","old_path":null,"path":"RedSalamander/FolderWindow.FileOperations.Popup.cpp","status":"modified","worktree_sha256":"eaf905999408575260d27337a05d9a0adf1306cedddc47180fc2f8807f2031cf","worktree_size_bytes":658608},{"base_mode":"100644","base_sha256":"f4333825f53af0be7b362a13db75d11512671ce74e39baa9e13d6583c639ae29","index_mode":"100644","index_sha256":"f4333825f53af0be7b362a13db75d11512671ce74e39baa9e13d6583c639ae29","old_path":null,"path":"RedSalamander/FolderWindow.FileOperations.Popup.h","status":"modified","worktree_sha256":"4a20dc496e8f79f312bc5e9ab66124757664b475ca658474193534408fdf3bcc","worktree_size_bytes":55308},{"base_mode":"100644","base_sha256":"1364a7eeea1d5c8584277e465cd4362f403cfc39ad9f7c991264487f70b5501d","index_mode":"100644","index_sha256":"1364a7eeea1d5c8584277e465cd4362f403cfc39ad9f7c991264487f70b5501d","old_path":null,"path":"RedSalamander/RedSalamander.vcxproj","status":"modified","worktree_sha256":"1808ddf7f43864f67c7c62e9ebc1bb6a6903b617716a8f3aa40ae8f98c51ea64","worktree_size_bytes":36249},{"base_mode":"100644","base_sha256":"60ecf1ded5c0f3d3bfa7dbb8549f0fc9d3f4b420b8ac9822be785ce54ac60d26","index_mode":"100644","index_sha256":"60ecf1ded5c0f3d3bfa7dbb8549f0fc9d3f4b420b8ac9822be785ce54ac60d26","old_path":null,"path":"Tests/ProductUiTests/ProductUiTests.cpp","status":"modified","worktree_sha256":"c7e51cbaddaedbf860190160830db5b9b1721e675f801749dffb063f844c102e","worktree_size_bytes":88854}],"git_discovery_ms":2231,"git_head":"ccebd5af68eb45f2e9deed64a7063780e71eb1ce","repo_identity":"fcada11a3a40743ab8434e4103123d8fb8263d20171103936518f47fc742d7f5","schema":"red-salamander.workspace-snapshot.v1","snapshot_id":"a8f9a67de89f37a41bda47df69a4c81ce6edbec5572dc18dad9118ee7bbe4c2d"}
